{
  "character_id": "char-pelayo",
  "display_name": "Pelayo",
  "aliases": [
    "Don Pelayo",
    "Pelagius"
  ],
  "historical_period": "early 8th century (c. 711–737)",
  "role": "monarch",
  "biography_short": "Caudillo visigodo convertido en líder de la resistencia cristiana en la cordillera cantábrica; figura central en la tradición de la batalla de Covadonga y fundador del núcleo del reino asturiano.",
  "voice_profile": {
    "tts_voice": "alloy",
    "tone": "grave, resolute, laconic",
    "words_per_second": 3.8,
    "delivery_modifiers": {
      "normal": 1,
      "shout": 1.4
    }
  },
  "visual_profile": {
    "age_range": "40-60",
    "hair": "dark, receding",
    "beard": "short, peppered",
    "clothing": "simple warrior garb: leather jerkin, cloak, helm for battle; later modest regal mantle",
    "palette": [
      "#6B4423",
      "#2F4F2F",
      "#8B6D5C"
    ],
    "style_notes": "rugged mountain leader; practical, battle-worn; iconography should balance rustic guerrilla with nascent royal dignity."
  },
  "state": {
    "status": "deceased",
    "location": "Asturias (historical)",
    "alliances": [
      "char-favila",
      "char-ermesinda"
    ],
    "conflicts": [],
    "last_seen_episode_id": "main-73701094-evt",
    "last_updated": "2026-03-19T17:39:56Z"
  },
  "continuity": {
    "must_keep": [
      "Leader of the rebel group at Covadonga (722)",
      "Associated with formation of early Asturian political nucleus",
      "Death circa 737 and succession by Favila"
    ],
    "must_avoid": [
      "Overstating precise biographical details not attested in the sources (birthplace, exact early life episodes)",
      "Portraying legendary miracles as proven facts without labeling them as tradition/legend"
    ]
  },
  "emotional_state": {
    "dominant_emotion": "resolve",
    "intensity": 0.85,
    "valence": 0.6,
    "arousal": 0.7,
    "trigger_summary": "Defending people from tribute/hostage demands and preserving autonomy in the mountains; victory at Covadonga raises status and responsibility."
  },
  "arc_state": {
    "stage": "ascent",
    "external_goal": "secure a safe political base in Asturias and repel Umayyad incursions",
    "internal_need": "consolidate authority beyond military leadership into recognized rulership",
    "contradiction": "limited resources and fragmentary aristocratic support vs. need to govern larger territory",
    "change_vector": "from fugitive guerrilla leader to foundational monarch",
    "last_event_id": "evt-73701"
  }
}
