{
  "character_id": "don_oppas",
  "display_name": "Don Oppas (Don Oppas / Oppa)",
  "aliases": [
    "Oppas",
    "Don Oppas"
  ],
  "historical_period": "early 8th century",
  "role": "religious",
  "biography_short": "A figure identified on the Muslim/visigothic side present in narratives of the pitched engagements against Pelayo's rebels; sources place him among commanders at relevant encounters.",
  "voice_profile": {
    "tts_voice": "verse",
    "tone": "clerical, somewhat conciliatory but formal",
    "words_per_second": 3.0,
    "delivery_modifiers": {
      "normal": 1.0,
      "shout": 1.05
    }
  },
  "visual_profile": {
    "age_range": "35-60 (inferred)",
    "hair": "dark (inferred)",
    "beard": "full or trimmed (inferred)",
    "clothing": "clerical/official garb when in court; commander dress in campaign depictions (inferred)",
    "palette": [
      "#5B4A3A",
      "#9E7B5A"
    ],
    "style_notes": "When used visually, emphasize his ambiguous position between ecclesiastical and political roles."
  },
  "state": {
    "status": "deceased",
    "location": "campaigns/northern Iberia",
    "alliances": [],
    "conflicts": [
      "pelayo"
    ],
    "last_seen_episode_id": "teaser-07340100-evt",
    "last_updated": "2026-03-19T18:40:00Z"
  },
  "continuity": {
    "must_keep": [
      "present_at_battle_descriptions_with_al_qama_and_pelayo"
    ],
    "must_avoid": [
      "overstating_political_power_without_evidence"
    ]
  },
  "emotional_state": {
    "dominant_emotion": "resolve",
    "intensity": 0.5,
    "valence": 0.2,
    "arousal": 0.4,
    "trigger_summary": "Participates as commander or notable figure in engagements recorded in chronicles."
  },
  "arc_state": {
    "stage": "crisis",
    "external_goal": "suppress rebels and reassert order",
    "internal_need": "maintain status within witizian/pro-Muslim party",
    "contradiction": "presence in sources but limited characterization",
    "change_vector": "participant in military events rather than central actor",
    "last_event_id": "evt-073401"
  }
}
