{
  "character_id": "pelayo",
  "display_name": "Pelayo",
  "aliases": [],
  "historical_period": "early 8th century (c. 722–737)",
  "role": "military",
  "biography_short": "Líder militar asturiano identificado en las fuentes del libro como el jefe de la sublevación en la Cornisa Cantábrica (Covadonga / Monte Auseva), instalado en Cangas de Onís y protagonista de victorias que atrajeron a otros núcleos cristianos del norte.",
  "voice_profile": {
    "tts_voice": "ballad",
    "tone": "grave, decidido, directo",
    "words_per_second": 3.6,
    "delivery_modifiers": {
      "normal": 1.0,
      "shout": 1.25
    }
  },
  "visual_profile": {
    "age_range": "adult (30-60)",
    "hair": "oscuro, despeinado por la vida de montaña (inferencia baja confianza)",
    "beard": "probablemente poblado (inferencia baja confianza)",
    "clothing": "ropa práctica de guerrero/rústica, capa sencilla, protecciones ligeras (inferencia basada en contexto militar montañoso)",
    "palette": [
      "#6B4C3B",
      "#7A7A6E",
      "#3A3A2E"
    ],
    "style_notes": "Apariencia austera de jefe de guerrilla; visual que comunique resiliencia y conocimiento del terreno (inferencia apoyada en fuentes sobre uso del monte y retiro a Cangas de Onís)."
  },
  "state": {
    "status": "deceased",
    "location": "Asturias",
    "alliances": [
      "ermesinda"
    ],
    "conflicts": [
      "al_qama"
    ],
    "last_seen_episode_id": "teaser-08650110-evt",
    "last_updated": "2026-03-18T23:45:00Z"
  },
  "continuity": {
    "must_keep": [
      "liderazgo en la insurrección del norte (Covadonga / Monte Auseva)",
      "instalación en Cangas de Onís como centro de resistencia"
    ],
    "must_avoid": [
      "presentar a Pelayo sin contexto cronológico (fechas 722–737/ános inmediatos)",
      "atribuir milagros o hechos legendarios sin fuente explícita"
    ]
  },
  "emotional_state": {
    "dominant_emotion": "resolve",
    "intensity": 0.8,
    "valence": 0.3,
    "arousal": 0.7,
    "trigger_summary": "derrotas/amenazas externas y la necesidad de proteger un enclave montañoso; victoria que aumenta la determinación"
  },
  "arc_state": {
    "stage": "ascent",
    "external_goal": "consolidar un núcleo político-militar en la Cornisa Cantábrica que resista la dominación musulmana",
    "internal_need": "legitimación del liderazgo frente a otras élites hispanogodas",
    "contradiction": "liderar una resistencia local con recursos y reconocimiento limitados",
    "change_vector": "de caudillo local a fundador de un referente político-militar asturiano",
    "last_event_id": "evt-086501"
  }
}
