{
  "character_id": "al_qama",
  "display_name": "Al Qama (Alkama / Alkama/Alkama variant)",
  "aliases": [
    "Alkama",
    "Alkama ibn ???"
  ],
  "historical_period": "early 8th century (campaigns c.722–750)",
  "role": "military",
  "biography_short": "Named in the sources as a Muslim commander who led forces against the Asturian rebels, involved in the pitched engagement(s) that surround Covadonga-era fighting.",
  "voice_profile": {
    "tts_voice": "onyx",
    "tone": "formal, measured, commanding but not ornate",
    "words_per_second": 3.5,
    "delivery_modifiers": {
      "normal": 1.0,
      "shout": 1.25
    }
  },
  "visual_profile": {
    "age_range": "30-50 (inferred)",
    "hair": "dark (inferred)",
    "beard": "full (inferred)",
    "clothing": "military tunic, lamellar/scale elements (inferred)",
    "palette": [
      "#3E4A59",
      "#C2A17A"
    ],
    "style_notes": "Depict as disciplined commander of mounted infantry; emphasize tactical disadvantage in mountain terrain."
  },
  "state": {
    "status": "deceased",
    "location": "campaigns in northern Iberia (Asturias)",
    "alliances": [],
    "conflicts": [
      "pelayo"
    ],
    "last_seen_episode_id": "teaser-07380100-evt",
    "last_updated": "2026-03-19T18:40:00Z"
  },
  "continuity": {
    "must_keep": [
      "muslim_commander_present_at_engagements_around_722-735"
    ],
    "must_avoid": [
      "modern_national_labels"
    ]
  },
  "emotional_state": {
    "dominant_emotion": "resolve",
    "intensity": 0.6,
    "valence": 0.2,
    "arousal": 0.6,
    "trigger_summary": "Conducting punitive or punitive-style expeditions against localized rebellions."
  },
  "arc_state": {
    "stage": "crisis",
    "external_goal": "reassert Muslim military dominance in contested northern zones",
    "internal_need": "restore order and assert authority for Córdoba's governors",
    "contradiction": "operational success elsewhere but difficulties in mountain warfare",
    "change_vector": "from expedition leader to part of the wider Muslim administration story",
    "last_event_id": "evt-074901"
  }
}
