{
  "character_id": "pelayo",
  "display_name": "Pelayo",
  "aliases": [
    "Don Pelayo"
  ],
  "historical_period": "Siglo VIII",
  "role": "military",
  "biography_short": "Lider de la resistencia astur y figura central en los primeros episodios del reino de Asturias.",
  "voice_profile": {
    "tts_voice": "alloy",
    "tone": "grave_resuelto",
    "words_per_second": 2.5,
    "delivery_modifiers": {
      "normal": 1.0,
      "shout": 1.18
    }
  },
  "visual_profile": {
    "age_range": "30-40",
    "hair": "castano oscuro, medio",
    "beard": "barba corta",
    "clothing": "tunica de lana, capa y elementos militares altomedievales",
    "palette": [
      "#4D5A6A",
      "#8D6B46",
      "#A9B2C0"
    ],
    "style_notes": "Mantener referencias altomedievales del norte peninsular, sin anacronismos."
  },
  "state": {
    "status": "active",
    "location": "Asturias",
    "alliances": [
      "alfonso_i"
    ],
    "conflicts": [
      "munuza"
    ],
    "last_seen_episode_id": "main-20260315-linea_01",
    "last_updated": "2026-03-15T09:30:00Z"
  },
  "continuity": {
    "must_keep": [
      "Liderazgo estrategico en contexto de resistencia",
      "Coherencia cronologica con las fuentes del reino de Asturias"
    ],
    "must_avoid": [
      "Lenguaje moderno",
      "Atributos visuales fuera del periodo"
    ]
  },
  "emotional_state": {
    "dominant_emotion": "resolve",
    "intensity": 0.81,
    "valence": 0.25,
    "arousal": 0.78,
    "trigger_summary": "Asume la resistencia tras la presion militar en su territorio."
  },
  "arc_state": {
    "stage": "turn",
    "external_goal": "Consolidar la resistencia y sostener el liderazgo regional.",
    "internal_need": "Convertir el impulso defensivo en vision politica estable.",
    "contradiction": "Instinto guerrero frente a necesidad de cohesion institucional.",
    "change_vector": "De caudillo reactivo a referente con proyeccion historica.",
    "last_event_id": "evt-1476"
  }
}
